{"id":"8F2K1QW7ZB","kind":"textbook","genre":["teaching"],"title":"Principles of Mathematical Analysis","creators":[{"name":"Walter Rudin","role":"author","ids":{"wikidata":"Q1000001"}}],"date":"1953","msc":[{"code":"26-01","from":"zbmath"}],"subjects":[{"system":"lcc","code":"QA300"},{"system":"ddc","code":"515"}],"ids":{"openlibrary_work":"OL100W"},"expressions":[{"key":"e3","kind":"edition","label":"3rd edition","language":"en","date":"1976","manifestations":[{"key":"m1","kind":"print","publisher":"McGraw-Hill","place":"New York","date":"1976","ids":{"isbn":["9780070000001","9780070000002"]},"access":{"class":"record","text":"closed"}}]}],"relations":[{"kind":"part_of","from":"e3","to":"7K3QX2M9R2","volume":"1"}],"scope":{"value":"in","rule":"S1","by":"m2/test"},"catalogue":[{"source":"openlibrary","snapshot":"blake3:00","native_id":"OL100W","level":"work"}],"history":[{"op":"add","at":"2026-10-30","by":"m2/test"}]}
